Electricity Sources,Electricity Sources (es),Electricity sources (power plants)
natural gas combined cycle,natural gas combined cycle es,natural gas combined cycle power plants
onshore wind,onshore wind es,onshore wind power plants
solar PV,solar PV es,solar PV power plants
petroleum,petroleum es,petroleum power plants
natural gas peaker,natural gas peaker es,natural gas peaker power plants
small modular reactor,small modular reactor es,small modular reactor power plants
hydrogen combustion turbine,hydrogen combustion turbine es,hydrogen combustion turbine power plants
hydrogen combined cycle,hydrogen combined cycle es,hydrogen combined cycle power plants
